Référence	ContexteGauche	Pivot	ContexteDroit
becket, p. 186, v. 6057	E_CONcoo quant_CONsub la_DETdef quaranteine_NOMcom des_PRE.DETdef meis_NOMcom fu_VERcjg trespassee_VERppe,_PONfbl E_CONcoo des_PRE.DETdef semaines_NOMcom fu_VERcjg la_DETdef quaranteine_NOMcom	entree_|entrée|_VERppe	,_PONfbl Lués_ADVgen fu_VERcjg de_PRE tutes_DETind parz_NOMcom Engleterre_NOMpro troblee_VERppe._PONfrt Se_CONsub saint_ADJqua Thomas_NOMpro n'_ADVneg eüst_VERcjg la_DETdef
becket, p. 187, v. 6072	gent_NOMcom veüe_VERppe._PONfrt Ne_ADVneg voleient_VERcjg aveir_VERinf sur_PRE els_PROper rei_NOMcom si_ADVgen puisant_ADJqua,_PONfbl Ainz_ADVgen voleient_VERcjg aveir_VERinf	entre_|entre|_PRE	els_PROper un_DETndf alaitant_VERppa K'_PROrel il_PROper peüssent_VERcjg detraire_VERinf ça_ADVgen e_CONcoo la_ADVgen cum_CONsub un_DETndf gant_NOMcom._PONfrt En_PRE
becket, p. 189, v. 6146	,_PONfbl E_CONcoo tels_PROind en_PROadv plorera_VERcjg qui_PROrel or_ADVgen s'_PROper en_PROadv vait_VERcjg riant_VERppa._PONfrt Tant_ADVgen cum_CONsub s'_PROper	entre_|entrer|_ADVgen	-_PONfbl amerunt_VERcjg e_CONcoo li_DETdef fiz_NOMcom e_CONcoo li_DETdef pere_NOMcom E_CONcoo il_PROper dui_PROcar amerunt_VERcjg e_CONcoo la_PROper broiz_NOMcom
BenDuc1b, p. 329, v. 10668	plus_ADVgen aidier_VERinf e_CONcoo plus_ADVgen valeir_VERinf._PONfrt Nul_DETind autre_ADJind chose_NOMcom,_PONfbl sanz_PRE mentir_VERinf,_PONfbl N'_ADVneg a_VERcjg	entre_|entre|_PRE	nos_PROper a_PRE departir_VERinf Fors_PRE pais_NOMcom,_PONfbl concorde_NOMcom,_PONfbl c'_PROdem est_VERcjg la_DETdef fin_NOMcom._PONfrt S'_DETpos os_NOMcom
BenDuc1b, p. 335, v. 10891	jor_NOMcom oct_VERcjg moct_ADJqua honnor_NOMcom e_CONcoo gloire_NOMcom E_CONcoo de_PRE ses_DETpos enemis_NOMcom victoire_NOMcom._PONfrt D'_PRE iloc_ADVgen est_VERcjg	entrez_|entrer|_VERppe	en_PRE lor_DETpos terre_NOMcom ;_PONfbl S'_CONsub il_PROper aveient_VERcjg talant_NOMcom de_PRE gerre_NOMcom,_PONfbl Des_PRE.DETdef or_NOMcom en_PROadv unt_VERcjg
BenDuc1b, p. 361, v. 11799	la_DETdef mort_NOMcom,_PONfbl a_PRE la_DETdef mort_NOMcom vient_VERcjg ;_PONfbl Nule_DETind dotance_NOMcom nes_ADVneg.PROper retient_VERcjg Qu'_CONsub enz_ADVgen nen_ADVneg	entrent_|entrer|_VERcjg	pur_PRE mort_NOMcom receivre_VERinf :_PONfbl Tant_ADVgen lor_PROper en_PROadv i_PROadv covint_VERcjg a_PRE beivre_VERinf Qu'_CONsub un_DETndf sol_ADJqua n'_ADVneg
BenDuc1b, p. 368, v. 12052	vos_DETpos aliance_NOMcom,_PONfbl Amor_NOMcom,_PONfbl tenemenz_NOMcom e_CONcoo fiance_NOMcom Dunt_PROrel nos_PROper seion_VERcjg mais_ADVgen a_PRE tuz_DETind dis_NOMcom	Entre_|entre|_PRE	nos_PROper deus_PROcar charneus_ADJqua amis_NOMcom ;_PONfbl N'_ADVneg en_PROadv voil_VERcjg nule_PROind tant_ADVgen que_CONsub je_PROper sace_VERcjg._PONfrt Or_ADVgen
BenDuc1b, p. 378, v. 12400	,_PONfbl fait_VERcjg il_PROper,_PONfbl des_PRE.DETdef or_NOMcom m'_PROper agree_VERcjg Que_CONcoo a_VERcjg Baieues_VERppe vos_PROper envei_VERcjg Deci_NOMcom qu'_PROrel	entre_|entre|_PRE	mei_PROper e_CONcoo le_DETdef rei_NOMcom De_PRE vostre_DETpos seignor_NOMcom repairom_VERcjg Senz_PRE mal_NOMcom,_PONfbl senz_PRE ire_NOMcom e_CONcoo senz_PRE
BenDuc1b, p. 383, v. 12579	ne_ADVneg fu_VERcjg se_DETpos merveille_NOMcom non_ADVneg._PONfrt Mais_CONcoo li_DETdef Normant_NOMpro e_CONcoo li_DETdef Breton_NOMpro Saisirent_VERcjg primes_ADVgen les_DETdef	entrees_|entrée|_NOMcom	:_PONfbl En_PRE treze_DETcar leus_NOMcom unt_VERcjg effondrees_NOMcom -_PONfbl Unc_ADVgen n'_ADVneg en_PROadv porent_VERcjg estre_VERinf destreinz_VERppe -_PONfbl Les_DETdef
BenDuc1b, p. 383, v. 12605	mes_DETpos genz_NOMcom,_PONfbl E_CONcoo si_ADVgen en_PROadv sordreit_VERcjg teus_DETind contenz_NOMcom -_PONfbl Od_PRE ce_PROdem qu'_CONsub il_PROper s'_PROper	entresunt_|entresunt|_VERcjg	sauvages_ADJqua E_CONcoo de_PRE plusors_DETind divers_ADJqua languages_NOMcom -_PONfbl Ja_ADVgen ne_ADVneg sereient_VERcjg departiz_VERppe,_PONfbl Si_ADVgen nn'i_ADVgen avreit_VERcjg
BenDuc1b, p. 384, v. 12624	nule_DETind rien_NOMcom ;_PONfbl Ne_CONcoo s'_PROper en_PROadv isi_VERcjg un_DETndf sul_ADJqua d'_PRE eus_PROper fors_ADVgen,_PONfbl Ainz_ADVgen i_PROadv	entrerent_|entrer|_VERcjg	cil_PROdem dehors_ADVgen :_PONfbl Tot_ADVgen trebuchoent_VERcjg e_CONcoo fundeient_VERcjg Si_ADVgen que_CONsub desvent_VERcjg sei_PROper e_CONcoo desleient_VERcjg._PONfrt Quant_CONsub
BenDuc1b, p. 385, v. 12644	ovraigne_NOMcom._PONfrt Sa_DETpos grant_ADJqua espee_NOMcom d'_PRE Alemaigne_NOMpro -_PONfbl U_PROrel out_VERcjg sis_DETpos livres_NOMcom de_PRE fin_ADJqua or_NOMcom	Entre_|entre|_PRE	le_DETdef heut_NOMcom e_CONcoo l'_DETdef entrecor_NOMcom,_PONfbl Od_PRE pierres_NOMcom fines_ADJqua,_PONfbl precioses_ADJqua,_PONfbl E_CONcoo od_PRE ovres_NOMcom
BenDuc1b, p. 385, v. 12654	«_PONpga Alez_VERcjg,_PONfbl fait_VERcjg il_PROper,_PONfbl si_ADVgen la_PROper mostrez_VERcjg A_PRE ceus_PROdem qui_PROrel ja_ADVgen i_PROadv sunt_VERcjg	entrez_|entrer|_VERppe	E_CONcoo as_PRE.DETdef autres_PROind qui_PROrel entrer_VERinf volent_VERcjg,_PONfbl E_CONcoo si_ADVgen facent_VERcjg,_PONfbl si_ADVgen cum_CONsub il_PROper solent_VERcjg
BenDuc1b, p. 385, v. 12655	,_PONfbl si_ADVgen la_PROper mostrez_VERcjg A_PRE ceus_PROdem qui_PROrel ja_ADVgen i_PROadv sunt_VERcjg entrez_VERppe E_CONcoo as_PRE.DETdef autres_PROind qui_PROrel	entrer_|entrer|_VERinf	volent_VERcjg,_PONfbl E_CONcoo si_ADVgen facent_VERcjg,_PONfbl si_ADVgen cum_CONsub il_PROper solent_VERcjg,_PONfbl Mun_DETpos conmandement_NOMcom senz_PRE desdire_VERinf
BenDuc1b, p. 386, v. 12687	;_PONfbl Mult_ADVgen s'_PROper entremostrent_VERcjg bel_ADJqua senblant_VERppa._PONfrt En_PRE une_DETndf sale_NOMcom riche_ADJqua e_CONcoo grant_ADJqua S'_PROper en_PROadv	entrerent_|entrer|_VERcjg	;_PONfbl la_ADVgen sunt_VERcjg assis_VERppe,_PONfbl La_ADVgen sunt_VERcjg lor_DETpos covenanz_NOMcom devis_VERcjg De_PRE fine_ADJqua amor_NOMcom,_PONfbl senz_PRE
BenDuc1b, p. 387, v. 12753	n'_ADVneg os_PROper seit_VERcjg offriz_VERppe._PONfrt »_PONpdr Mult_ADVgen l'_PROper en_PROadv rent_VERcjg li_DETdef dux_NOMcom granz_ADJqua merciz_NOMcom._PONfrt	Entre_|entre|_PRE	tanz_DETind dis_NOMcom od_PRE les_DETdef Saissons_NOMpro Teneit_VERcjg dux_NOMcom Cones_VERcjg granz_ADJqua sermons_NOMcom E_CONcoo granz_ADJqua paroles_NOMcom par_PRE envie_NOMcom
BenDuc1b, p. 390, v. 12843	seignorance_NOMcom._PONfrt Ce_PROdem qui_PROrel vostre_PROpos ert_VERcjg mien_ADJpos ensement_ADVgen,_PONfbl E_CONcoo tex_PROind seit_VERcjg nostre_DETpos aliement_NOMcom Qu'_CONcoo	entre_|entre|_PRE	nos_PROper deus_PROcar nus_PROind ne_ADVneg se_PROper mete_VERcjg Por_PRE rien_PROind qu'_PROrel il_PROper dont_VERcjg ne_ADVneg qu'_CONsub il_PROper pramete_VERcjg
BenDuc1b, p. 390, v. 12847	cuer_NOMcom seion_NOMcom e_CONcoo d'_PRE un_DETndf voleir_NOMcom Sanz_PRE fauser_VERinf e_CONcoo sanz_PRE deceveir_VERinf._PONfrt Isi_ADVgen seion_VERcjg ceint_VERppe	entre_|entre|_PRE	nos_PROper,_PONfbl Quer_CONcoo de_PRE c'_PROdem est_VERcjg mis_VERppe cuers_NOMcom desiros_ADJqua._PONfrt Joiosement_ADVgen,_PONfbl sanz_PRE rien_PROind doter_VERinf
BenDuc1b, p. 394, v. 12979	alee_VERppe Tote_DETind la_DETdef jent_NOMcom conmuneument_ADVgen Repleni_VERppe d'_PRE esjoïssement_NOMcom._PONfrt Nus_PROind ne_ADVneg fu_VERcjg mais_ADVgen en_PRE vile_NOMcom	entrez_|entrer|_VERppe	Sos_PRE cel_DETdem plus_NOMcom i_PROadv fust_VERcjg dessirez_VERppe :_PONfbl Por_PRE lui_PROper veer_VERinf e_CONcoo esgarder_VERinf Veïsseiz_VERppe jent_NOMcom par_PRE
BenDuc1b, p. 396, v. 13049	Baudoïns_NOMpro._PONfrt Cist_DETdem dui_PROcar i_PROadv vindrent_VERcjg tuit_ADVgen premer_ADJqua Por_PRE le_DETdef saint_ADJqua lieu_NOMcom rapareillier_VERinf._PONfrt Cist_PROdem	entrerent_|entrer|_VERcjg	en_PRE la_DETdef gastine_NOMcom E_CONcoo virent_VERcjg la_DETdef grant_ADJqua desertine_NOMcom E_CONcoo la_DETdef forest_NOMcom grant_ADJqua,_PONfbl parcreüe_VERppe,_PONfbl
BenDuc1b, p. 421, v. 13938	por_PRE tei_PROper mesler_VERinf._PONfrt Autre_PROind em_PROadv porreit_VERcjg deseriter_VERinf,_PONfbl Aiz_VERcjg que_CONsub rompisse_VERcjg l'_DETdef aliance_NOMcom Qu'_CONcoo	entre_|entre|_PRE	nos_PROper est_VERcjg,_PONfbl ne_CONcoo la_DETdef fiance_NOMcom._PONfrt Tant_ADVgen est_VERcjg entre_PRE nos_PROper granz_ADJqua amors_NOMcom Nen_ADVneg.PROper avras_VERcjg
BenDuc1b, p. 421, v. 13939	que_CONsub rompisse_VERcjg l'_DETdef aliance_NOMcom Qu'_CONcoo entre_PRE nos_PROper est_VERcjg,_PONfbl ne_CONcoo la_DETdef fiance_NOMcom._PONfrt Tant_ADVgen est_VERcjg	entre_|entre|_PRE	nos_PROper granz_ADJqua amors_NOMcom Nen_ADVneg.PROper avras_VERcjg ja_ADVgen par_PRE mei_PROper secors_NOMcom._PONfrt Je_PROper ne_ADVneg vuil_VERcjg mie_ADVneg que_CONsub
BenDuc1b, p. 431, v. 14267	feus_NOMcom E_CONcoo les_DETdef genz_NOMcom prechaine_ADJqua e_CONcoo veisine_ADJqua :_PONfbl Si_ADVgen n'_ADVneg i_PROadv convendreit_VERcjg pas_ADVneg veisine_NOMcom._PONfrt	Entre_|entre|_PRE	Franceis_NOMpro e_CONcoo voz_DETpos Normanz_NOMpro Prie_VERcjg que_CONsub seit_VERcjg paiz_VERppe parmaignanz_VERppa,_PONfbl E_CONcoo s'_PROper entre_VERcjg vos_PROper a_PRE
BenDuc1b, p. 431, v. 14269	veisine_NOMcom._PONfrt Entre_PRE Franceis_NOMpro e_CONcoo voz_DETpos Normanz_NOMpro Prie_VERcjg que_CONsub seit_VERcjg paiz_VERppe parmaignanz_VERppa,_PONfbl E_CONcoo s'_PROper	entre_|entrer|_VERcjg	vos_PROper a_PRE aliance_NOMcom N'_ADVneg avra_VERcjg entr'eus_VERppe puis_PRE mesestance_NOMcom ;_PONfbl Les_DETdef provinces_NOMcom en_PROadv serrunt_VERcjg lees_ADJqua Plenteïves_ADJqua
BenDuc1b, p. 436, v. 14466	batié_NOMcom l'_DETdef onde_NOMcom._PONfrt Parfunz_ADJqua i_PROadv fu_VERcjg mult_ADVgen le_DETdef trespas_NOMcom._PONfrt La_ADVgen s'_PROper en_PROadv est_VERcjg	entrez_|entrer|_VERppe	li_DETdef Judas_NOMpro,_PONfbl Od_PRE lui_PROper Rious_VERinf,_PONfbl s'_PROper i_PROadv fu_VERcjg Roberz_NOMpro,_PONfbl Henris_NOMpro e_CONcoo Bauces_NOMcom
BenDuc1b, p. 436, v. 14476	compaignons_NOMcom Past_VERcjg jusque_PRE la_PROper od_PRE avirons_NOMcom,_PONfbl Kar_CONcoo malade_ADJqua est_VERcjg,_PONfbl si_ADVgen ne_ADVneg vout_VERcjg mie_ADVneg	Entrer_|entrer|_VERinf	en_PRE l'_DETdef ost_NOMcom de_PRE Normendie_NOMpro._PONfrt La_ADVgen parlerunt_VERcjg lor_DETpos ovre_NOMcom sole_ADJqua Senz_PRE noise_NOMcom e_CONcoo senz_PRE
BenDuc1b, p. 437, v. 14480	senz_PRE presse_NOMcom e_CONcoo senz_PRE fule_NOMcom._PONfrt Od_PRE duze_DETcar compaignons_NOMcom nomez_VERppe Est_VERcjg li_DETdef dux_NOMcom el_PRE.DETdef batel_NOMcom	entrez_|entrer|_VERppe	._PONfrt Outre_ADVgen naga_VERcjg la_ADVgen u_CONcoo cil_PROdem erent_VERcjg Qui_PROrel mult_ADVgen beau_ADJqua semblant_NOMcom li_PROper mostrerent_VERcjg._PONfrt Contre_PRE
BenDuc1b, p. 439, v. 14572	veit_VERcjg encor_ADVgen ne_CONcoo leu_NOMcom ne_CONcoo aise_NOMcom De_PRE comencier_VERinf sa_DETpos cruelté_NOMcom._PONfrt En_PRE un_DETndf chalan_NOMcom furent_VERcjg	entré_|entrer|_VERppe	Trestuit_DETind li_DETdef doze_ADJcar ensemblement_ADVgen E_CONcoo arivé_VERppe devers_PRE lor_DETpos gent_NOMcom,_PONfbl E_CONcoo li_DETdef dux_NOMcom s'_PROper en_PROadv
BenDuc1b, p. 440, v. 14622	poet_VERcjg estre_VERinf venjance_NOMcom prise_VERppe,_PONfbl Kar_CONcoo si_ADVgen haute_ADJqua par_PRE est_VERcjg la_DETdef rive_NOMcom N'_ADVneg i_PROadv puet_VERcjg	entrer_|entrer|_VERinf	home_NOMcom qui_PROrel vive_VERcjg ;_PONfbl Sovent_ADVgen s'_PROper i_PROadv pasment_VERcjg de_PRE dolor_NOMcom._PONfrt Tels_DETind criz_NOMcom ne_CONcoo tels_DETind
BenDuc1b, p. 442, v. 14675	tut_DETind dreit_NOMcom acheminent_VERcjg,_PONfbl Mais_CONcoo de_PRE dol_NOMcom faire_VERinf ore_ADVgen ne_ADVneg finent_VERcjg._PONfrt Des_ADVgen qu'_CONsub il_PROper	entrent_|entrer|_VERcjg	en_PRE Normendie_NOMpro,_PONfbl Tote_DETind la_DETdef terre_NOMcom brait_VERcjg e_CONcoo crie_VERcjg E_CONcoo toz_DETind li_DETdef poples_NOMcom s'_PROper i_PROadv
BenDuc1b, p. 442, v. 14680	est_VERcjg mie_ADVneg nez_VERppe qui_PROrel vos_PROper retraie_VERcjg La_DETdef siste_ADJord part_NOMcom de_PRE la_DETdef dolor_NOMcom Qui_PROrel a_PRE Roem_NOMpro	entra_|entrer|_VERcjg	le_DETdef jor_NOMcom._PONfrt Ne_ADVneg poent_VERcjg esgarder_VERinf la_DETdef biere_NOMcom,_PONfbl Si_ADVgen est_VERcjg l'_DETdef angoisse_NOMcom pesme_ADJqua e_CONcoo
BenDuc1b, p. 444, v. 14747	eisi_ADVgen puisse_VERcjg terre_NOMcom tenir_VERinf Qu'_CONcoo a_PRE gré_NOMcom li_PROper seit_VERcjg e_CONcoo a_PRE plaisir_VERinf._PONfrt Ne_ADVneg sorde_VERcjg	entre_|entre|_PRE	nos_PROper desacorz_VERinf ;_PONfbl Destruiz_VERppe en_PRE seriom_NOMcom e_CONcoo morz_VERppe,_PONfbl Kar_CONcoo tant_ADVgen cum_CONsub voudrom_VERcjg nos_PROper amer_VERinf
Fantosme, p. 2, v. 13	e_CONcoo en_PRE aïe_NOMcom Od_PRE mun_DETpos fiz_NOMcom seiez_VERcjg tenant_VERppa,_PONfbl salve_VERcjg ma_DETpos seignurie_NOMcom !_PONfrt ”_PONpdr Puis_ADVgen	entre_|entre|_PRE	vus_PROper e_CONcoo vostre_DETpos fiz_NOMcom mortel_ADJqua nasquid_VERcjg envie_NOMcom,_PONfbl Dunt_PROrel maint_DETind gentil_ADJqua chevalier_NOMcom ad_VERcjg puis_ADVgen perdu_VERppe
Fantosme, p. 12, v. 150	barnage_NOMcom :_PONfbl «_PONpga Pleins_ADJqua estes_VERcjg de_PRE buntez_NOMcom._PONfrt Trestuz_DETind voz_DETpos enemis_NOMcom sunt_VERcjg en_PRE mal_NOMcom an_PROadv	entrez_|entrer|_VERcjg	._PONfrt Vostrë_ADVgen est_VERcjg la_DETdef terre_NOMcom,_PONfbl si_ADVgen la_PROper defendez_VERcjg !_PONfrt A_PRE tort_NOMcom vus_PROper guerreie_VERcjg li_DETdef
Fantosme, p. 32, v. 429	Berewic-sur-Tine_NOMpro troevent_VERcjg les_DETdef noteniers_NOMcom Kis_PROrel.PROper amerrunt_VERcjg en_PRE Flandres_NOMpro,_PONfbl les_DETdef sages_ADJqua messagiers_NOMcom._PONfrt Ja_ADVgen sunt_VERcjg	entrez_|entrer|_VERppe	en_PRE barges_NOMcom e_CONcoo vunt_VERcjg en_PRE halte_ADJqua mer_NOMcom,_PONfbl E_CONcoo traient_VERcjg sus_PRE lur_DETpos sigles_NOMcom,_PONfbl si_ADVgen
Fantosme, p. 66, v. 879	pout_VERcjg aver_VERinf mestier_NOMcom assaut_VERcjg ne_ADVneg vavassur_NOMcom Ne_CONcoo serjant_NOMcom në_CONcoo escuier_NOMcom dunt_PROrel cil_PROdem aient_VERcjg poür_NOMcom._PONfrt	Entre_|entre|_PRE	lui_PROper e_CONcoo le_DETdef cunte_NOMcom se_PROper mistrent_VERcjg al_PRE.DETdef retur_NOMcom,_PONfbl Desqu'al_NOMcom demein_ADVgen a_PRE l'_DETdef aube_NOMcom quant_CONsub
Fantosme, p. 72, v. 992	fors_ADVgen de_PRE l'_PROper aler_VERinf._PONfrt »_PONpdr Tost_ADVgen i_PROadv purrïez_VERcjg oïr_VERinf e_CONcoo bien_ADVgen en_PRE halt_ADJqua crier_VERinf	Entre_|entre|_PRE	Flamens_NOMpro de_PRE Flandres_NOMpro e_CONcoo Franceis_NOMpro e_CONcoo Puier_VERinf :_PONfbl «_PONpga Nus_PROind n'_ADVneg eimes_VERcjg pas_ADVneg en_PRE cest_DETdem
Fantosme, p. 104, v. 1399	devisiun_NOMcom,_PONfbl E_CONcoo devenez_VERcjg ses_DETpos hum_NOMcom par_PRE tel_DETind conditiun_NOMcom :_PONfbl Tant_ADVgen vus_PROper durrad_VERcjg aveir_VERinf,_PONfbl	entre_|entre|_PRE	or_ADVgen fin_ADJqua e_CONcoo mangun_NOMcom,_PONfbl E_CONcoo plus_ADVgen encore_ADVgen asez_ADVgen que_CONsub nus_PROind ne_ADVneg vus_PROper dium_VERcjg._PONfrt
Fantosme, p. 108, v. 1446	Il_PROper ad_VERcjg enz_ADVgen el_PRE.DETdef chastel_NOMcom asez_ADVgen vin_NOMcom e_CONcoo furment_NOMcom,_PONfbl Si_ADVgen sunt_VERcjg a_PRE un_DETndf acort_NOMcom	entre_|entre|_PRE	lui_PROper e_CONcoo sa_DETpos gent_NOMcom._PONfrt Dire_VERinf m'_PROper estuvrad_VERcjg trestut_DETind quanqu'a_NOMcom message_NOMcom apent_VERcjg :_PONfbl Rien_PROind ne_ADVneg
Fantosme, p. 110, v. 1473	dedenz_PRE lur_DETpos serjanz_NOMcom marchis_NOMcom,_PONfbl E_CONcoo treis_DETcar cunestablës_NOMcom el_PRE.DETdef chastel_NOMcom unt_VERcjg asis_VERppe._PONfrt Asez_ADVgen unt_VERcjg	entrë_|entre|_NOMcom	eus_VERcjg grant_ADJqua risee_NOMcom e_CONcoo grant_ADJqua ris_NOMcom :_PONfbl Il_PROper nel_ADVneg.PROper quident_VERcjg mes_ADVgen perdre_VERinf desqu'al_NOMcom jor_NOMcom de_PRE
Fantosme, p. 122, v. 1628	le_PROper verrez_VERcjg de_PRE ci_ADVgen qu'_CONsub a_PRE quinze_DETcar dis_NOMcom._PONfrt »_PONpdr Ore_ADVgen est_VERcjg Richart_NOMpro de_PRE Luci_NOMpro	entrez_|entrer|_VERppe	en_PRE grant_ADJqua baudur_NOMcom,_PONfbl Mande_VERcjg Robert_NOMpro de_PRE Vaus_NOMpro mar_ADVgen seit_VERcjg en_PRE esfreur_NOMcom :_PONfbl Il_PROper avrad_VERcjg
Fantosme, p. 130, v. 1758	aportent_VERcjg dunt_PROrel il_PROper se_PROper est_VERcjg disné_VERppe._PONfrt E_CONcoo les_DETdef noz_ADJpos chevaliers_NOMcom en_PRE un_DETndf bruil_NOMcom sunt_VERcjg	entré_|entrer|_VERppe	;_PONfbl La_ADVgen si_ADVgen unt_VERcjg lur_DETpos espie_NOMcom,_PONfbl ki_PROrel tut_PROind lur_PROper ad_VERcjg cunté_VERppe._PONfrt Dit_VERcjg Randulf_NOMpro
Fantosme, p. 134, v. 1800	Araz_NOMpro !_PONfrt »_PONpdr Li_DETdef reis_NOMcom jut_VERcjg a_PRE la_DETdef terre_NOMcom abatu_VERppe,_PONfbl ço_PROdem vus_PROper di_VERcjg ;_PONfbl	Entre_|entre|_PRE	ses_DETpos quisses_NOMcom giseit_VERcjg le_DETdef cheval_NOMcom sur_PRE li_PROper ;_PONfbl Jamés_ADVgen n'_ADVneg en_PROadv levera_VERcjg pur_PRE parent_NOMcom ne_CONcoo
Fantosme, p. 144, v. 1950	culcheur_NOMcom,_PONfbl Li_PROper vint_VERcjg tele_DETind novele_NOMcom dunt_PROrel il_PROper out_VERcjg grant_ADJqua honur_NOMcom._PONfrt Li_DETdef reis_NOMcom esteit_VERcjg	entré_|entrer|_VERppe	en_PRE sa_DETpos chambre_NOMcom demeine_ADJqua,_PONfbl Quant_CONsub li_DETdef message_NOMcom vint_VERcjg._PONfrt Suffert_VERppe ot_VERcjg mult_ADVgen grant_ADJqua peine_NOMcom
Fantosme, p. 146, v. 1968	eire_NOMcom !_PONfrt Mun_DETpos seignur_NOMcom ad_VERcjg el_PRE.DETdef cuer_NOMcom e_CONcoo dolur_NOMcom e_CONcoo cuntraire_VERinf._PONfrt Si_ADVgen me_PROper laissiez_VERcjg	entrer_|entrer|_VERinf	,_PONfbl chamberleng_NOMcom de_PRE bon_ADJqua aire_NOMcom !_PONfrt »_PONpdr E_CONcoo dit_VERcjg li_DETdef chamberlens_NOMcom :_PONfbl «_PONpga Ne_ADVneg l'_PROper
Fantosme, p. 146, v. 1984	dist_VERcjg li_DETdef reis_NOMcom,_PONfbl queus_DETrel noveles_NOMcom aportez_VERppe ?_PONfrt Est_VERcjg li_DETdef reis_NOMcom d'_PRE Escocë_NOMpro en_PROadv Richemunt_VERcjg	entrez_|entrer|_VERppe	?_PONfrt Le_DETdef Nuef_NOMcom Chastel_NOMpro sur_PRE Tine_NOMcom saisi_VERppe,_PONfbl les_DETdef fermetez_NOMcom ?_PONfrt Odinel_ADJqua de_PRE Umfranvile_NOMpro est_VERcjg
thomas, p. 19, v. 1		entre_|entre|_PRE	ses_DETpos bras_NOMcom Yseut_NOMpro la_DETdef reine_NOMcom._PONfrt Bien_ADVgen cuidoient_VERcjg estre_VERinf a_PRE seür_ADJqua,_PONfbl sorvint_VERcjg i_PROper par_PRE
thomas, p. 25, v. 194	mal_NOMcom ne_ADVneg deit_VERcjg mal_ADVgen rendre_VERinf._PONfrt L'_DETdef un_PROind fait_VERppe deit_VERcjg l'_DETdef altre_PROind si_ADVgen sofrir_VERinf que_CONsub	entre_|entre|_PRE	euls_PROper se_PROper deivent_VERcjg guarantir_VERinf :_PONfbl ne_CONcoo trop_ADVgen amer_VERinf pur_PRE colvertise_NOMcom,_PONfbl ne_CONcoo trop_ADVgen haïr_VERinf pur_PRE
thomas, p. 33, v. 448	la_DETdef deraigne_ADJqua feiz_NOMcom qu'_PROrel il_PROper i_PROadv parla_VERcjg._PONfrt Tristran_NOMpro reguarde_VERcjg,_PONfbl veit_VERcjg l'_DETdef anel_NOMcom e_CONcoo	entre_|entre|_PRE	en_PRE un_DETndf pensé_NOMcom novel_ADJqua._PONfrt Del_PRE.DETdef penser_NOMcom fu_VERcjg en_PRE grant_ADJqua anguisse_NOMcom,_PONfbl qu'_CONsub il_PROper ne_ADVneg
thomas, p. 38, v. 630	,_PONfbl aveir_VERinf torment_NOMcom dunt_PROrel plus_ADVgen aie_VERcjg paine_NOMcom sovent_ADVgen ne_CONcoo dunt_PROrel aie_VERcjg anguisse_NOMcom greinur_ADJqua,_PONfbl ait_VERcjg	entre_|entre|_PRE	nos_DETpos ire_NOMcom u_CONcoo amur_NOMcom :_PONfbl car_CONcoo si_ADVgen delit_VERcjg de_PRE li_DETdef desir_NOMcom,_PONfbl dunc_ADVgen m'_PROper irt_VERcjg
thomas, p. 51, v. 1011	bien_ADVgen._PONfrt Coment_ADVint devroit_VERcjg de_PRE ce_PROdem doter_VERinf dont_PROrel unques_ADVgen n'_ADVneg ot_VERcjg riens_PROind en_PRE penser_VERinf ?_PONfrt	Entre_|entre|_PRE	ces_DETdem quatre_PROcar ot_VERcjg estrange_ADJqua amor_NOMcom ;_PONfbl tut_ADVgen en_PROadv ourent_VERcjg painne_NOMcom e_CONcoo dolur_NOMcom,_PONfbl e_CONcoo un_PROind
thomas, p. 57, v. 1204	u_PROrel die_VERcjg ce_PROdem que_PROrel n'_ADVneg i_PROadv amunte_VERcjg ?_PONfrt Dirrai_VERcjg la_DETdef sume_NOMcom e_CONcoo la_DETdef fin_NOMcom._PONfrt	Entre_|entre|_PRE	Tristran_NOMpro e_CONcoo Kaerdin_NOMpro tant_ADVgen unt_VERcjg chavalchié_VERppe e_CONcoo erré_VERppe qu'_CONsub il_PROper vienent_VERcjg a_PRE une_DETndf cité_NOMcom u_PROrel
thomas, p. 59, v. 1261	sulunc_PRE ce_PROdem qu'_CONsub en_PRE l'_DETdef amur_NOMcom par_PRE fo_VERcjg e_CONcoo de_PRE raisun_NOMcom l_PROper vers_PRE els_PROper que_CONsub	entre_|entre|_PRE	Dunc_ADVgen dit_VERcjg Kaerdin_NOMpro :_PONfbl «_PONpga Or_ADVgen la_PROper vei_VERcjg !_PONfrt Ceste_DETdem devant_NOMcom est_VERcjg la_DETdef reïne_NOMcom._PONfrt
thomas, p. 64, v. 1377	franche_ADJqua Brengven_NOMpro._PONfrt Si_ADVgen vaillante_VERppa ne_CONcoo si_ADVgen leele_NOMcom ne_ADVneg fud_VERcjg unques_ADVgen mais_CONcoo damisele_NOMcom,_PONfbl mais_CONcoo	entre_|entre|_PRE	vus_PROper et_CONcoo Kaherdin_NOMpro l'_PROper avez_VERcjg sustraite_VERppe par_PRE engin_NOMcom._PONfrt Vus_PROper la_PROper vulez_VERcjg od_PRE vus_PROper mener_VERinf
thomas, p. 67, v. 1460	._PONfrt D'_PRE altre_DETind part_NOMcom jo_PROper l'_PROper ai_VERcjg fait_VERppe par_PRE vus_PROper :_PONfbl mal_ADVgen ne_ADVneg deit_VERcjg aveir_VERinf	entre_|entre|_PRE	nus_PROind._PONfrt Nostre_DETpos curuz_NOMcom a_PRE ren_PROind n'_ADVneg amunte_VERcjg,_PONfbl unques_ADVgen nel_ADVneg.PROper fiz_VERcjg pur_PRE vostre_DETpos hunte_NOMcom
thomas, p. 70, v. 1582	avez_VERcjg ben_ADVgen conseilé_VERppe._PONfrt Ne_ADVneg fust_VERcjg la_DETdef consence_NOMcom de_PRE vus_PROper,_PONfbl ja_ADVgen folie_NOMcom n'_ADVneg eust_VERcjg	entre_|entre|_PRE	nus_PROind ;_PONfbl mais_CONcoo pur_PRE ço_PROdem que_CONsub le_PROper consentistes_VERcjg,_PONfbl ço_PROdem que_PROrel faire_VERinf dui_PROcar m'_PROper apreïstes_VERcjg
thomas, p. 76, v. 1790	un_DETndf flavel_NOMcom._PONfrt A_PRE la_DETdef curt_NOMcom le_DETdef rei_NOMcom puis_ADVgen s'_CONsub en_PRE vad_NOMcom e_CONcoo pres_ADVgen des_PRE.DETdef	entrees_|entrée|_NOMcom	se_PROper trait_VERcjg,_PONfbl e_CONcoo desire_VERcjg mult_ADVgen a_PRE saver_VERinf l'_DETdef estre_NOMcom de_PRE la_DETdef curt_NOMcom e_CONcoo veer_VERinf
thomas, p. 78, v. 1840	ki_PROrel si_ADVgen s'_PROper embat_VERcjg sur_PRE les_DETdef baruns_NOMcom ;_PONfbl les_DETdef serjanz_NOMcom apele_VERcjg vilains_NOMcom qui_PROrel le_PROper suffrent_VERcjg	entre_|entre|_PRE	les_DETdef seins_NOMcom,_PONfbl e_CONcoo dit_VERcjg a_PRE Ysolt_NOMpro qu'_CONsub ele_PROper est_VERcjg feinte_VERppe :_PONfbl «_PONpga Des_ADVgen quant_CONsub
thomas, p. 86, v. 2102	mais_CONcoo il_PROper les_PROper perdirent_VERcjg a_PRE tant_ADVgen._PONfrt El_PRE.DETdef bois_NOMcom se_PROper mistrent_VERcjg,_PONfbl el_PRE.DETdef chimin_NOMcom,_PONfbl	entre_|entre|_PRE	Tristran_NOMpro e_CONcoo Kaherdin_NOMpro ;_PONfbl les_DETdef tresturz_NOMcom des_PRE.DETdef deserz_NOMcom errerent_VERcjg e_CONcoo pur_PRE iço_PROdem d'_PRE eus_PROper se_PROper
thomas, p. 86, v. 2113	relesser_VERinf._PONfrt Ne_ADVneg vol_VERcjg pas_ADVneg trop_ADVgen en_PRE uni_NOMcom dire_VERinf,_PONfbl ici_ADVgen diverse_DETind la_DETdef matyre_NOMcom._PONfrt	Entre_|entre|_PRE	ceus_PROdem qui_PROrel solent_VERcjg cunter_VERinf e_CONcoo del_PRE.DETdef cunte_NOMcom Tristran_NOMpro parler_VERinf,_PONfbl il_PROper en_PROadv cuntent_VERcjg diversement_ADVgen._PONfrt
thomas, p. 88, v. 2189	._PONfrt Lungs_ADJqua ert_VERcjg e_CONcoo grant_ADJqua e_CONcoo ben_ADVgen pleners_ADJqua,_PONfbl armez_VERppe ert_VERcjg e_CONcoo beas_NOMcom chevalers_NOMcom._PONfrt	Entre_|entre|_PRE	Tristran_NOMpro e_CONcoo Kaherdin_NOMpro l'_PROper encuntre_ADVgen attendent_VERcjg el_PRE.DETdef chimin_NOMcom,_PONfbl mult_ADVgen se_PROper merveillent_VERcjg qui_PROrel ço_PROdem seit_VERcjg
thomas, p. 96, v. 2458	entendez_VERcjg que_CONsub jo_PROper vus_PROper di_VERcjg._PONfrt Pernez_VERcjg cest_DETdem anel_NOMcom ove_PRE vus_PROper :_PONfbl ço_PROdem sunt_VERcjg enseingnes_NOMcom	entre_|entre|_PRE	nus_PROind._PONfrt E_CONcoo quant_CONsub en_PRE la_DETdef terre_NOMcom vendrez_VERcjg,_PONfbl en_PRE curt_ADJqua marcheant_NOMcom vus_PROper ferez_VERcjg e_CONcoo
thomas, p. 101, v. 2623	aime_VERcjg plus_ADVgen._PONfrt Tres_ADVgen que_CONsub overt_VERppe furent_VERcjg li_DETdef us_NOMcom,_PONfbl Ysolt_NOMpro est_VERcjg en_PRE la_DETdef chambre_NOMcom	entree_|entrée|_VERppe	,_PONfbl vers_PRE Tristan_NOMpro ad_VERcjg s'_DETpos ire_NOMcom celee_VERppe,_PONfbl sert_VERcjg le_PROper e_CONcoo mult_ADVgen li_PROper fait_VERcjg bel_ADJqua
thomas, p. 102, v. 2643	il_PROper vent_VERcjg a_PRE la_DETdef terre_NOMcom u_PROrel vait_VERcjg pur_PRE la_DETdef reïne_NOMcom quere_VERinf :_PONfbl ço_PROdem est_VERcjg l'_DETdef	entree_|entrée|_NOMcom	de_PRE Tamise_NOMpro._PONfrt Vait_VERcjg amunt_ADVgen od_PRE sa_DETpos marchandise_NOMcom ;_PONfbl en_PRE la_DETdef buche_NOMcom,_PONfbl dehors_PRE l'_DETdef
thomas, p. 102, v. 2645	de_PRE Tamise_NOMpro._PONfrt Vait_VERcjg amunt_ADVgen od_PRE sa_DETpos marchandise_NOMcom ;_PONfbl en_PRE la_DETdef buche_NOMcom,_PONfbl dehors_PRE l'_DETdef	entree_|entrée|_NOMcom	,_PONfbl en_PRE un_DETndf port_NOMcom ad_VERcjg sa_DETpos nef_NOMcom ancree_VERppe ;_PONfbl a_PRE sun_DETpos batel_NOMcom en_PROadv va_VERcjg amunt_ADVgen
thomas, p. 105, v. 2739	lasser_VERinf._PONfrt Ore_ADVgen vus_PROper membre_VERcjg des_PRE.DETdef granz_ADJqua amurs_NOMcom e_CONcoo des_PRE.DETdef peines_NOMcom e_CONcoo des_PRE.DETdef dolurs_NOMcom qu'_PROrel	entre_|entre|_PRE	vus_PROper dous_PROcar avez_VERcjg suffert_VERppe !_PONfrt Sa_DETpos vie_NOMcom e_CONcoo sa_DETpos juvente_NOMcom pert_VERcjg ;_PONfbl pur_PRE vus_PROper ad_VERcjg
thomas, p. 105, v. 2746	:_PONfbl pensez_VERcjg des_PRE.DETdef mals_NOMcom qu'_PROrel il_PROper ad_VERcjg eü_VERppe._PONfrt Del_PRE.DETdef covenant_NOMcom vus_PROper deit_VERcjg membrer_VERppe qu'_CONsub	entre_|entre|_PRE	vus_PROper fud_VERcjg al_PRE.DETdef desevrer_VERinf einz_ADVgen el_PRE.DETdef jardin_NOMcom u_PROrel le_PROper baisates_VERcjg,_PONfbl quant_CONsub vus_PROper cest_DETdem anel_NOMcom
