Référence	ContexteGauche	Pivot	ContexteDroit
mf, YONEC, p. 113, v. 347	tint_VERcjg,_PONfbl De_PRE si_ADVgen qu'_CONsub a_PRE une_DETndf hoge_NOMcom vint_VERcjg._PONfrt En_PRE cele_DETdem hoge_NOMcom ot_VERcjg une_DETndf	entree_|entrée|_NOMcom	,_PONfbl De_PRE cel_DETdem sanc_NOMcom fu_VERcjg tute_ADVgen arusee_VERppe ;_PONfbl Ne_ADVneg pot_VERcjg nïent_PROind avant_ADVgen veeir_VERinf._PONfrt Dunc_ADVgen
mf, YONEC, p. 113, v. 351	;_PONfbl Ne_ADVneg pot_VERcjg nïent_PROind avant_ADVgen veeir_VERinf._PONfrt Dunc_ADVgen quidot_VERcjg ele_PROper bien_ADVgen saveir_VERinf Que_CONsub sis_DETpos amis_NOMcom	entrez_|entrer|_VERppe	i_PROadv seit_VERcjg :_PONfbl Dedenz_ADVgen se_PROper met_VERcjg a_PRE grant_ADJqua espleit_NOMcom._PONfrt El_PROper n'_ADVneg i_PROadv trovat_VERcjg nule_DETind
mf, YONEC, p. 113, v. 372	cenz_DETcar tres_NOMcom._PONfrt La_DETdef porte_NOMcom aval_ADVgen fu_VERcjg desfermee_VERppe ;_PONfbl La_DETdef dame_NOMcom est_VERcjg en_PRE la_DETdef vile_NOMcom	entree_|entrer|_VERppe	Tuz_DETind jurs_NOMcom aprés_PRE le_DETdef sanc_NOMcom novel_ADJqua,_PONfbl Par_PRE mi_NOMcom le_DETdef burc_NOMcom,_PONfbl desk'al_NOMcom chastel_NOMcom._PONfrt
mf, YONEC, p. 114, v. 379	vient_VERcjg al_PRE.DETdef paviment_NOMcom,_PONfbl Del_PRE.DETdef sanc_NOMcom le_PROper treve_VERcjg tut_ADVgen sanglent_ADJqua._PONfrt En_PRE une_DETndf bele_ADJqua chambre_NOMcom	entra_|entrer|_VERcjg	,_PONfbl Un_DETndf chevalier_NOMcom dormant_VERppa trova_VERcjg ;_PONfbl Nel_ADVneg.PROper cunut_VERcjg pas_ADVneg,_PONfbl si_ADVgen vet_VERcjg avant_ADVgen._PONfrt En_PRE
mf, YONEC, p. 114, v. 386	dormant_VERppa desus_ADVgen._PONfrt Ele_PROper s'_PROper en_PROadv est_VERcjg utre_NOMcom passee_VERppe,_PONfbl En_PRE la_DETdef tierce_ADJord chambre_NOMcom est_VERcjg	entree_|entrée|_VERppe	:_PONfbl Le_DETdef lit_NOMcom sun_DETpos ami_NOMcom ad_VERcjg trové_VERppe._PONfrt Li_DETdef pecol_NOMcom sunt_VERcjg d'_PRE or_ADVgen esmeré_VERppe ;_PONfbl
mf, YONEC, p. 114, v. 407	dolur_NOMcom,_PONfbl Si_ADVgen vus_PROper i_PROadv esteiez_VERcjg trovee_VERppe,_PONfbl Mut_ADVgen en_PROadv serïez_VERcjg turmentee_VERppe._PONfrt Bien_ADVgen iert_VERcjg	entre_|entre|_PRE	ma_DETpos gent_NOMcom seü_VERppe Que_CONsub m'_PROper unt_VERcjg por_PRE vostre_DETpos amur_NOMcom perdu_VERppe._PONfrt Pur_PRE vus_PROper sui_VERcjg dolenz_ADJqua
mf, YONEC, p. 116, v. 453	._PONfrt E_CONcoo quant_CONsub de_PRE paumesuns_NOMcom revint_VERcjg,_PONfbl Vers_PRE la_DETdef hoge_NOMcom sa_DETpos veie_NOMcom tint_VERcjg ;_PONfbl Dedenz_ADVgen	entra_|entrer|_VERcjg	,_PONfbl utre_NOMcom est_VERcjg passee_VERppe,_PONfbl Si_ADVgen s'_PROper en_PROadv reveit_VERcjg en_PRE sa_DETpos cuntree_NOMcom._PONfrt Ensemblement_ADVgen od_PRE
mf, LAÜSTIC, p. 120, v. 18	chiere_ADJqua Sulunc_PRE l'_DETdef usage_NOMcom e_CONcoo la_DETdef maniere_NOMcom._PONfrt Li_DETdef autres_PROind fu_VERcjg uns_DETndf bachelers_NOMcom Bien_ADVgen coneüz_VERppe	entre_|entre|_PRE	ses_DETpos pers_NOMcom,_PONfbl De_PRE pruësce_NOMcom,_PONfbl de_PRE grant_ADJqua valur_NOMcom,_PONfbl E_CONcoo volentiers_ADVgen feseit_VERcjg honur_NOMcom :_PONfbl
mf, MILUN, p. 127, v. 36	duns_NOMcom E_CONcoo grant_ADJqua amistié_NOMcom li_PROper premet_VERcjg._PONfrt «_PONpga Amis_NOMpro,_PONfbl fet_VERcjg il_PROper,_PONfbl or_ADVgen t'_PROper	entremet_|entremettre|_VERcjg	Qu'_CONsub a_PRE m'_DETpos amie_NOMcom puisse_VERcjg parler_VERinf E_CONcoo de_PRE nostre_DETpos cunseil_NOMcom celer_VERinf._PONfrt Mun_DETpos anel_NOMcom d'_PRE
mf, MILUN, p. 130, v. 139	._PONfrt Jeo_NOMpro ne_ADVneg soi_VERcjg pas_ADVneg que_CONsub fust_VERcjg issi_ADVgen,_PONfbl Ainz_ADVgen quidoue_VERcjg aveir_VERinf mun_DETpos ami_NOMcom ;_PONfbl	Entre_|entre|_PRE	nus_PROind celisum_VERcjg l'_DETdef afaire_NOMcom,_PONfbl Ja_ADVgen ne_ADVneg l'_PROper oïsse_VERcjg aillurs_ADVgen retraire_VERinf._PONfrt Mieuz_ADVgen me_PROper vendreit_VERcjg
mf, MILUN, p. 132, v. 208	._PONfrt Ele_PROper apelat_VERcjg un_DETndf suen_ADJpos vallet_NOMcom,_PONfbl Puis_ADVgen si_ADVgen li_PROper dit_VERcjg :_PONfbl «_PONpga Or_ADVgen t'_PROper	entremet_|entremettre|_VERcjg	Que_CONsub mis_DETpos cignes_NOMcom seit_VERcjg bien_ADVgen gardez_VERppe E_CONcoo ke_CONsub il_PROper eit_VERcjg vïande_NOMcom asez_ADVgen._PONfrt -_PONpga Dame_NOMcom
mf, MILUN, p. 133, v. 215	gia_NOMcom est_VERcjg ceo_PROdem presenz_ADJqua rëaus_NOMcom :_PONfbl Veez_VERcjg cum_CONsub il_PROper est_VERcjg bons_ADJqua e_CONcoo beaus_ADJqua !_PONfrt »_PONpdr	Entre_|entre|_PRE	ses_DETpos mains_NOMcom li_PROper baille_VERcjg e_CONcoo rent_VERcjg,_PONfbl El_PROper le_PROper receit_VERcjg mut_ADVgen bonement_ADVgen._PONfrt Le_DETdef col_NOMcom
mf, MILUN, p. 134, v. 278	cigne_NOMcom sifaitement_ADVgen._PONfrt »_PONpdr Si_ADVgen ferat_VERcjg il_PROper hastivement_ADVgen._PONfrt Vint_DETcar anz_NOMcom menerent_VERcjg cele_DETdem vie_NOMcom Milun_NOMpro	entre_|entre|_PRE	lui_PROper e_CONcoo s'_DETpos amie_NOMcom._PONfrt Del_PRE.DETdef cigne_NOMcom firent_VERcjg messagier_NOMcom,_PONfbl N'_ADVneg i_PROadv aveient_VERcjg autre_PROind enparlier_VERinf
mf, MILUN, p. 141, v. 477	l'_PROper oï_VERcjg,_PONfbl a_PRE pié_NOMcom descent_VERcjg,_PONfbl Sun_DETpos peire_NOMcom baisa_VERcjg ducement_ADVgen ;_PONfbl Mut_ADVgen bel_ADJqua semblant_NOMcom	entre_|entre|_PRE	eus_PROper feseient_VERcjg E_CONcoo iteus_ADJqua paroles_NOMcom diseient_VERcjg Que_CONsub li_DETdef autre_PROind kis_PROrel.PROper esgardouent_VERcjg De_PRE joie_NOMcom e_CONcoo de_PRE
mf, CHAITIVEL, p. 147, v. 139	I_PROadv aveit_VERcjg iteus_NOMcom deus_DETcar milliers_NOMcom Ki_PROrel lur_DETpos ventaille_NOMcom deslacierent_VERcjg,_PONfbl Chevoiz_VERcjg e_CONcoo barbes_NOMcom detrahierent_VERcjg ;_PONfbl	Entre_|entre|_PRE	eus_PROper esteit_VERcjg li_DETdef doels_NOMcom communs_ADJqua._PONfrt Sur_PRE sun_DETpos escu_NOMcom fu_VERcjg mis_VERppe chescuns_PROind ;_PONfbl En_PRE la_DETdef
mf, CHIEVREFOIL, p. 154, v. 94	s'_PROper esluina_VERcjg,_PONfbl Dedenz_PRE le_DETdef bois_NOMcom celui_PROdem trova_VERcjg Que_CONsub plus_ADVgen amot_VERcjg que_CONsub rien_PROind vivant_NOMcom :_PONfbl	Entre_|entre|_PRE	eus_PROper meinent_VERcjg joie_NOMcom mut_ADVgen grant_ADJqua._PONfrt A_PRE li_PROper parlat_VERcjg tut_ADVgen a_PRE leisir_NOMcom E_CONcoo ele_PROper li_PROper
mf, ELIDUC, p. 158, v. 90	passez_VERppe,_PONfbl En_PRE Toteneis_NOMpro est_VERcjg arivez_VERppe._PONfrt Plusurs_DETind reis_NOMcom i_PROadv ot_VERcjg en_PRE la_DETdef tere_NOMcom,_PONfbl	Entre_|entre|_PRE	eus_PROper eurent_VERcjg estrif_NOMcom e_CONcoo guere_NOMcom._PONfrt Vers_PRE Excestrë_NOMcom,_PONfbl en_PRE cel_DETdem païs_NOMcom,_PONfbl Maneit_NOMpro uns_DETndf
mf, ELIDUC, p. 161, v. 209	queil_DETrel maniere_NOMcom a_PRE eus_PROper puindrunt_VERcjg E_CONcoo cum_CONsub il_PROper les_PROper escrïerunt_VERcjg._PONfrt Quant_CONsub al_PRE.DETdef destreit_NOMcom furent_VERcjg	entrez_|entrer|_VERppe	,_PONfbl Elidus_NOMpro les_PROper ad_VERcjg escriez_VERppe ;_PONfbl Tuz_ADVgen apela_VERcjg ses_DETpos cumpainuns_NOMcom,_PONfbl De_PRE bien_ADVgen faire_VERinf les_PROper
mf, ELIDUC, p. 164, v. 286	mena_VERcjg un_DETndf chevalier_NOMcom ;_PONfbl A_PRE la_DETdef pucele_NOMcom veit_VERcjg parler_VERinf._PONfrt Quant_CONsub en_PRE la_DETdef chambre_NOMcom dut_VERcjg	entrer_|entrer|_VERinf	,_PONfbl Le_DETdef chamberlenc_NOMcom enveie_VERcjg avant_ADVgen,_PONfbl E_CONcoo il_PROper s'_PROper alat_VERcjg aukes_PROind targant_VERppa De_PRE ci_ADVgen que_CONsub
mf, ELIDUC, p. 170, v. 484	s'_PROper esmeot_VERcjg._PONfrt Li_DETdef reis_NOMcom est_VERcjg del_PRE.DETdef mangier_VERinf levez_VERppe,_PONfbl Es_PRE.DETdef chambres_NOMcom sa_DETpos fille_NOMcom est_VERcjg	entrez_|entrer|_VERppe	;_PONfbl As_PRE.DETdef eschés_NOMcom cumence_VERcjg a_PRE juër_NOMcom A_PRE un_DETndf chevalier_NOMcom d'_PRE utre_NOMcom mer_NOMcom ;_PONfbl De_PRE l'_DETdef
mf, ELIDUC, p. 170, v. 496	,_PONfbl a_PRE cest_DETdem chevalier_NOMcom Vus_PROper devrïez_VERcjg bien_ADVgen aquintier_VERinf E_CONcoo fere_VERinf lui_PROper mut_VERcjg grant_ADJqua honur_NOMcom :_PONfbl	Entre_|entre|_PRE	cinc_PROcar cenz_PROcar nen_ADVneg ad_VERcjg meillur_ADJqua !_PONfrt »_PONpdr Quant_CONsub la_DETdef meschine_NOMcom ot_VERcjg escuté_VERppe Ceo_PROdem que_PROrel sis_DETpos
mf, ELIDUC, p. 172, v. 542	,_PONfbl mut_ADVgen ad_VERcjg bien_ADVgen fet_VERppe._PONfrt Sovent_ADVgen peot_VERcjg parler_VERinf od_PRE s'_DETpos amie_NOMcom,_PONfbl Granz_ADJqua est_VERcjg	entre_|entre|_PRE	eus_PROper la_DETdef druërie_NOMcom._PONfrt Tant_ADVgen s'_PROper est_VERcjg de_PRE la_DETdef guere_NOMcom entremis_VERppe Qu'_CONsub il_PROper aveit_VERcjg retenu_VERppe
mf, ELIDUC, p. 173, v. 575	anguissusement_NOMcom l'_PROper amot_VERcjg E_CONcoo ele_PROper lui_PROper,_PONfbl ke_CONsub plus_ADVgen ne_ADVneg pot_VERcjg._PONfrt Mes_CONcoo n'_ADVneg ot_VERcjg	entre_|entre|_PRE	eus_PROper nule_DETind folie_NOMcom,_PONfbl Joliveté_NOMcom ne_CONcoo vileinie_ADJqua ;_PONfbl De_PRE douneier_VERinf e_CONcoo de_PRE parler_VERinf E_CONcoo de_PRE
mf, ELIDUC, p. 175, v. 667	cumence_VERcjg a_PRE desmenter_VERinf._PONfrt La_DETdef buche_NOMcom li_PROper baise_VERcjg sovent_ADVgen E_CONcoo si_ADVgen plure_VERcjg mut_ADVgen tendrement_ADVgen._PONfrt	Entre_|entre|_PRE	ses_DETpos braz_NOMcom la_PROper prist_VERcjg e_CONcoo tint_VERcjg Tant_ADVgen que_CONsub de_PRE paumeisuns_NOMcom revint_VERcjg._PONfrt «_PONpga Par_PRE Deu_NOMpro
mf, ELIDUC, p. 176, v. 674	est_VERcjg trestuz_DETind mis_DETpos conforz_NOMcom._PONfrt Pur_PRE ceo_PROdem preng_VERcjg jeo_PROper cunseil_NOMcom de_PRE vus_PROper Que_CONsub fïancë_NOMcom ad_VERcjg	entre_|entre|_PRE	nus_PROind._PONfrt Pur_PRE busuin_NOMcom vois_VERcjg en_PRE mun_DETpos païs_NOMcom._PONfrt A_PRE vostre_DETpos pere_NOMcom ai_VERcjg cungié_NOMcom pris_VERppe
mf, ELIDUC, p. 176, v. 696	me_PROper retienge_VERcjg,_PONfbl Pur_PRE ceo_PROdem que_PROrel seie_VERcjg vis_NOMcom e_CONcoo seins_NOMcom._PONfrt Ma_DETpos vie_NOMcom est_VERcjg tute_ADVgen	entre_|entre|_PRE	voz_DETpos meins_NOMcom._PONfrt »_PONpdr Cele_PROdem ot_VERcjg de_PRE lui_PROper la_DETdef grant_ADJqua amur_NOMcom ;_PONfbl Terme_NOMpro li_PROper dune_VERcjg
mf, ELIDUC, p. 180, v. 810	li_PROper s'_PROper en_PROadv vet_VERcjg hastivement_ADVgen._PONfrt Al_PRE.DETdef hafne_NOMcom vient_VERcjg a_PRE Toteneis_NOMpro,_PONfbl En_PRE la_DETdef nef_NOMcom	entrent_|entrer|_VERcjg	demaneis_ADVgen ;_PONfbl N'_ADVneg i_PROadv ot_VERcjg humme_NOMcom si_ADVgen les_DETdef suens_ADJpos nun_NOMcom E_CONcoo s'_DETpos amie_NOMcom Guillïadun_NOMpro._PONfrt
mf, ELIDUC, p. 181, v. 847	!_PONfrt Si_ADVgen m'_DETpos amie_NOMcom leüst_VERcjg laissier_VERinf,_PONfbl Jeol_NOMcom vus_PROper eüsse_VERcjg vendu_VERppe chier_ADJqua._PONfrt »_PONpdr Mes_CONcoo	entre_|entre|_PRE	ses_DETpos braz_NOMcom la_PROper teneit_VERcjg E_CONcoo cunfortout_VERcjg ceo_PROdem qu'_PROrel il_PROper poeit_VERcjg Del_PRE.DETdef mal_NOMcom que_PROrel ele_PROper aveit_VERcjg
mf, ELIDUC, p. 183, v. 910	ensemble_ADVgen od_PRE sei_PROper._PONfrt Le_DETdef dreit_ADJqua chemin_NOMcom unt_VERcjg tant_ADVgen erré_VERppe Qu'_CONsub il_PROper esteient_VERcjg el_PRE.DETdef bois_NOMcom	entré_|entrer|_VERppe	._PONfrt A_PRE la_DETdef chapele_NOMcom sunt_VERcjg venu_VERppe,_PONfbl Apelé_VERppe i_PROadv unt_VERcjg e_CONcoo batu_VERppe ;_PONfbl N'_ADVneg i_PROadv
mf, ELIDUC, p. 185, v. 989	il_PROper ne_ADVneg l'_PROper ad_VERcjg aparceü_VERppe._PONfrt Bien_ADVgen ad_VERcjg esgardé_VERppe e_CONcoo veü_VERppe Cument_ADVsub en_PRE la_DETdef chapele_NOMcom	entra_|entrer|_VERcjg	,_PONfbl Le_DETdef dol_NOMcom oï_VERppe qu'_CONsub il_PROper demena_VERcjg._PONfrt Ainz_ADVgen qu'_CONsub Elidus_NOMpro s'_PROper en_PROadv seit_VERcjg eissuz_VERppe
mf, ELIDUC, p. 186, v. 1010	od_PRE sei_PROper ;_PONfbl A_PRE l'_DETdef hermitage_NOMcom l'_PROper ad_VERcjg menee_VERppe._PONfrt Quant_CONsub en_PRE la_DETdef chapele_NOMcom est_VERcjg	entree_|entrée|_VERppe	,_PONfbl El_PROper vit_VERcjg le_DETdef lit_NOMcom a_PRE la_DETdef pucele_NOMcom Ki_PROrel resemblot_VERcjg rose_NOMcom nuvele_ADJqua ;_PONfbl Del_PRE.DETdef cuvertur_NOMcom
mf, ELIDUC, p. 190, v. 1150	Le_DETdef jur_NOMcom qu'_CONsub il_PROper l'_PROper aveit_VERcjg espusee_VERppe._PONfrt Ensemble_ADVgen vesquirent_VERcjg meint_DETind jur_NOMcom,_PONfbl Mut_ADVgen ot_VERcjg	entre_|entre|_PRE	eus_PROper parfite_VERppe amur_NOMcom._PONfrt Granz_ADJqua aumoines_NOMcom e_CONcoo granz_ADJqua biens_NOMcom firent_VERcjg,_PONfbl Tant_ADVgen que_CONsub a_PRE Deu_NOMpro
CommPsia1a, p. 82	avra_VERcjg ja_ADVgen nuit_NOMcom,_PONfbl fait_VERcjg il_PROper._PONfrt Vos_PROper savez_VERcjg bien_ADVgen que_CONsub la_DETdef nuiz_NOMcom qui_PROrel vient_VERcjg	entre_|entre|_PRE	deus_DETcar jors_NOMcom,_PONfbl ele_PROper fait_VERcjg de_PRE l'_DETdef un_PROind heri_VERcjg et_CONcoo de_PRE l'_DETdef altre_ADJind cras_NOMcom._PONfrt
CommPsia1a, p. 87	introivit_VERcjg Sathanas_NOMpro in_PRE cor_NOMcom Jude_NOMpro._PONfrt Lors_ADVgen,_PONfbl ço_PROdem dist_VERcjg,_PONfbl aprés_PRE le_DETdef morsel_NOMcom li_PROper	entra_|entrer|_VERcjg	Sathanas_NOMpro el_PRE.DETdef cuer_NOMcom._PONfrt Et_CONcoo dunc_ADVgen s'_PROper en_PROadv fuï_VERcjg Christus_NOMpro li_DETdef voirs_ADJqua David_NOMpro a_PRE facie_NOMcom
CommPsia1a, p. 87	fuï_VERcjg Christus_NOMpro li_DETdef voirs_ADJqua David_NOMpro a_PRE facie_NOMcom Absalon_NOMpro,_PONfbl ço_PROdem est_VERcjg de_PRE Juda_NOMpro,_PONfbl car_CONcoo	entre_|entre|_PRE	lui_PROper et_CONcoo le_DETdef diable_NOMcom ne_ADVneg poent_VERcjg ensemble_ADVgen manoir_VERinf._PONfrt Or_ADVgen esguarduns_VERcjg un_DETndf grant_ADJqua sacrament_NOMcom et_CONcoo
CommPsia1a, p. 87	manja_VERcjg si_ADVgen fu_VERcjg perduz_VERppe._PONfrt Et_CONcoo loés_ADVgen,_PONfbl ço_PROdem dist_VERcjg,_PONfbl avoec_PRE le_DETdef morsel_NOMcom li_PROper	entra_|entrer|_VERcjg	li_DETdef diables_NOMcom el_PRE.DETdef cors_NOMcom._PONfrt Cum_CONsub orible_ADJqua cose_NOMcom ço_PROdem est_VERcjg,_PONfbl et_CONcoo cum_CONsub grande_ADJqua cose_NOMcom
CommPsia1a, p. 87	,_PONfbl certes_ADVgen cil_PROdem se_PROper poet_VERcjg mult_ADVgen doter_VERinf ne_CONcoo cum_CONsub accipit_NOMcom vitam_VERppe incurrat_ADVgen in_ETR mortem_ETR -_PONfbl	entros_|entros|_VERcjg	qu'_CONsub il_PROper prent_VERcjg la_DETdef vie_NOMcom qu'_CONsub il_PROper ne_ADVneg cure_VERcjg en_PRE la_DETdef mort_NOMcom._PONfrt Aprés_ADVgen dist_VERcjg
CommPsia1a, p. 93	le_PROper fait_VERcjg._PONfrt Et_CONcoo n'_ADVneg est_VERcjg pas_ADVneg merveille_NOMcom,_PONfbl car_CONcoo il_PROper i_PROadv a_VERcjg grant_ADJqua proismeté_NOMcom	entre_|entre|_PRE	le_DETdef cief_NOMcom et_CONcoo les_DETdef membres_NOMcom._PONfrt Nostre_DETpos Sire_NOMcom Jhesus_NOMpro est_VERcjg caput_VERppe ecclesie_NOMcom et_CONcoo tot_DETind li_DETdef
CommPsia1a, p. 96	il_PROper dit_VERcjg in_PRE Ewangelio_NOMpro :_PONfbl Cum_CONsub oraveris_NOMcom intra_VERcjg in_PRE cubiculum_NOMpro._PONfrt Cum_CONsub tu_PROper oreras_VERcjg,_PONfbl	entre_|entre|_PRE	en_PRE ta_DETpos chambre_NOMcom et_ETR clauso_ETR hostio_ETR ora_VERcjg Patrem_ETR tuum_ETR,_PONfbl et_CONcoo a_VERcjg clos_VERppe uis_NOMcom ore_ADVgen
CommPsia1a, p. 101	etc_ADVgen._PONfrt Deus_NOMpro est_VERcjg veritas_NOMcom,_PONfbl mendatium_NOMcom est_ETR contrarium_ETR veritati_ETR._PONfrt Il_PROper i_PROadv a_VERcjg guerre_NOMcom	entre_|entre|_PRE	verté_NOMcom et_CONcoo mençunge_NOMcom,_PONfbl et_CONcoo Deus_NOMpro qui_PROrel vertez_ADVgen est_VERcjg destruira_VERcjg toz_DETind ceals_PROdem qui_PROrel la_DETdef mençunge_NOMcom
CommPsia1a, p. 103	in_PRE perfectione_NOMcom._PONfrt Car_CONcoo pur_PRE ceo_PROdem aore_VERcjg um_NOMcom Deu_NOMpro que_PROrel um_PROind volt_VERcjg aprés_PRE l'_PROper aoreir_VERcjg	entreir_|entrer|_VERinf	en_PRE la_DETdef maisun_NOMcom Deu_NOMpro,_PONfbl et_CONcoo pur_PRE ço_PROdem achate_VERcjg um_PROind le_DETdef mantel_NOMcom que_CONsub um_PROind le_PROper
CommPsia1a, p. 103	._PONfrt Ceo_PROdem apert_VERcjg bien_ADVgen qu'_CONsub ele_PROper remua_VERcjg sa_DETpos parole_NOMcom,_PONfbl car_CONcoo puis_ADVgen que_CONsub ele_PROper iert_VERcjg	entreie_|entreie|_NOMcom	ne_ADVneg cremera_VERcjg ele_PROper mie_ADVneg._PONfrt Mais_CONcoo por_PRE ceo_PROdem crient_VERcjg um_PROind que_PROrel um_PROind i_PROadv volt_VERcjg entreir_VERinf
CommPsia1a, p. 103	entreie_NOMcom ne_ADVneg cremera_VERcjg ele_PROper mie_ADVneg._PONfrt Mais_CONcoo por_PRE ceo_PROdem crient_VERcjg um_PROind que_PROrel um_PROind i_PROadv volt_VERcjg	entreir_|entrer|_VERinf	en_PRE la_DETdef maisum_NOMcom Deu_NOMpro._PONfrt En_PRE la_DETdef maisum_NOMcom Deu_NOMpro est_VERcjg perfecta_ADJqua caritas_NOMcom et_CONcoo cele_DETdem carités_NOMcom
CommPsia1a, p. 106	pains_NOMcom est_VERcjg mult_ADVgen ameirs_VERinf as_PRE.DETdef feluns_NOMcom,_PONfbl si_ADVgen cum_CONsub a_PRE Judas_NOMpro quil_PROrel.PROper manja_VERcjg si_ADVgen li_PROper	entra_|entrer|_VERcjg	li_DETdef diables_NOMcom el_PRE.DETdef cors_NOMcom._PONfrt Tele_DETind cum_CONsub est_VERcjg ta_DETpos conscience_NOMcom,_PONfbl tels_PROind te_PROper devient_VERcjg cist_DETdem
CommPsia1a, p. 108	,_PONfbl altre_PROind qui_PROrel apartient_VERcjg a_PRE l'_DETdef anme_NOMcom._PONfrt La_DETdef premire_PROord generatiuns_NOMcom fu_VERcjg del_PRE.DETdef tans_NOMcom Adam_NOMpro	entres_|entrer|_VERcjg	que_CONsub a_PRE l'_DETdef advent_NOMcom nostre_DETpos Segnor_NOMcom et_CONcoo apartient_VERcjg al_PRE.DETdef cors_NOMcom,_PONfbl car_CONcoo il_PROper faisoient_VERcjg les_DETdef
CommPsia1a, p. 110	ele_PROper ci_ADVgen soit_VERcjg castiee_VERppe,_PONfbl qu'_CONsub ele_PROper puist_VERcjg loés_ADVgen,_PONfbl quant_CONsub ele_PROper la_PROper venra_VERcjg,_PONfbl	entrer_|entrer|_VERinf	in_ADVgen octavum_VERcjg,_PONfbl ço_PROdem est_VERcjg in_PRE vitam_NOMcom eternam_ADJqua._PONfrt Aiez_VERcjg merci_NOMcom de_PRE moi_PROper,_PONfbl Sire_NOMcom
CommPsia1a, p. 113	larmes_NOMcom de_PRE mun_DETpos cuer_NOMcom._PONfrt Torblés_VERppe est_VERcjg de_PRE furor_NOMcom mes_CONcoo oilz_NOMcom ;_PONfbl jo_PROper sui_VERcjg envieseiz_VERppe	entre_|entre|_PRE	toz_DETind mes_DETpos enemis_NOMcom._PONfrt TURBATUS_VERppe EST_VERcjg A_PRE FURORE_NOMcom OCULUS_NOMpro MEUS_VERppe ;_PONfbl INVETERAVI_NOMpro INTER_NOMcom OMNES_NOMpro INIMICOS_NOMcom
CommPsia1a, p. 113	?_PONfrt Inveteravi_NOMcom inter_PRE omnes_PROind inimicos_NOMcom meos_ADJqua._PONfrt Jo_PROper sui_VERcjg viele_NOMcom devenue_VERppe,_PONfbl fait_VERcjg ele_PROper,_PONfbl	entre_|entre|_PRE	mes_DETpos enemis_NOMcom._PONfrt De_PRE ceste_DETdem viellece_NOMcom dist_VERcjg li_DETdef Apostles_NOMcom :_PONfbl Expurgate_NOMcom vetus_NOMpro fermentum_VERcjg ut_PROrel sitis_ADVgen
CommPsia1a, p. 114	reconu_VERppe par_PRE confessiun_NOMcom que_PROrel jo_PROper sui_VERcjg envezie_VERppe et_CONcoo del_PRE.DETdef pechié_NOMcom Adam_NOMpro et_CONcoo des_PRE.DETdef miens_NOMcom meïsmes_ADJind	entre_|entre|_PRE	mes_DETpos enemis_NOMcom,_PONfbl les_DETdef malignes_ADJqua esperites_NOMcom et_CONcoo les_DETdef faus_ADJqua christiens_NOMcom qui_PROrel me_PROper desturbent_VERcjg de_PRE mun_DETpos
CommPsia1a, p. 122	,_PONfbl ET_CONcoo PATIENS_NOMcom ;_PONfbl NUNQUID_VERcjg IRASCITUR_NOMpro PER_ETR SINGULOS_ETR DIES_ETR ?_PONfrt Deus_DETcar iudex_NOMcom iustus_VERinf etc_ADVgen._PONfrt	Entros_|entros|_ADVgen	que_CONsub ci_ADVgen a_PRE il_PROper parlé_VERppe pro_PRE verbis_NOMcom Chusi_VERcjg -_PONfbl Chusi_VERcjg,_PONfbl ceo_PROdem vos_PROper desimes_VERcjg la_DETdef
CommPsia1a, p. 123	,_PONfbl sone_VERcjg en_PRE latin_ADJqua silentium_NOMcom,_PONfbl taisance_VERppa -_PONfbl car_CONcoo taisantment_VERppa et_CONcoo humlement_ADVgen a_PRE il_PROper parlé_VERppe	entres_|entrer|_VERcjg	que_CONsub ci_ADVgen de_PRE ses_DETpos persecutiuns_NOMcom,_PONfbl de_PRE ço_PROdem qu'_CONsub il_PROper n'_ADVneg a_VERcjg mie_ADVneg rendu_VERppe mal_NOMcom
CommPsia1a, p. 138	,_PONfbl les_DETdef temporels_ADJqua biens_NOMcom._PONfrt Cantez_VERcjg psalme_NOMcom al_PRE.DETdef Seignor_NOMcom qui_PROrel maint_VERcjg en_PRE Syon_NOMpro ;_PONfbl annuntietz_NOMcom	entre_|entre|_PRE	les_DETdef gens_NOMcom les_DETdef estuides_NOMcom de_PRE lui_PROper._PONfrt PSALLITE_ETR DOMINO_ETR QUI_VERcjg HABITAT_NOMpro IN_PRE SYON_NOMcom ;_PONfbl ANNUNTIATE_NOMpro
CommPsia1a, p. 139	etc_ADVgen._PONfrt Les_DETdef portes_NOMcom de_PRE mort_NOMcom apele_VERcjg il_PROper cupiditates_VERppe seculi_ETR,_PONfbl car_CONcoo si_ADVgen cum_CONsub alcuns_PROind	entre_|entrer|_VERcjg	et_CONcoo ist_VERcjg par_PRE la_DETdef porte_NOMcom,_PONfbl ensement_ADVgen par_PRE le_PROper covoitisse_VERcjg del_PRE.DETdef siecle_NOMcom ist_VERcjg um_PROind de_PRE
CommPsia1a, p. 139	le_PROper covoitisse_VERcjg del_PRE.DETdef siecle_NOMcom ist_VERcjg um_PROind de_PRE la_DETdef voie_NOMcom de_PRE raisum_NOMcom et_CONcoo de_PRE religium_NOMcom si_ADVgen	entre_|entre|_PRE	um_NOMcom es_PRE.DETdef voies_NOMcom de_PRE pecié_VERppe et_CONcoo de_PRE perditiun_NOMcom._PONfrt U_CONcoo,_PONfbl se_CONsub vos_PROper volés_VERcjg,_PONfbl
CommPsia1a, p. 139	sens_NOMcom del_PRE.DETdef cors_NOMcom par_PRE cui_PROrel tot_DETind li_DETdef pecié_NOMcom et_CONcoo les_DETdef covoitises_NOMcom et_CONcoo les_DETdef corporés_ADJqua delectatiuns_NOMcom	entrent_|entrer|_VERcjg	a_PRE l'_DETdef amme_NOMcom._PONfrt Ço_PROdem est_VERcjg visus_ADVgen,_PONfbl le_DETdef veüe_NOMcom,_PONfbl u_PRE.DETdef parent_NOMcom le_DETdef vanitez_NOMcom
CommPsia1a, p. 139	est_VERcjg visus_ADVgen,_PONfbl le_DETdef veüe_NOMcom,_PONfbl u_PRE.DETdef parent_NOMcom le_DETdef vanitez_NOMcom del_PRE.DETdef siecle_NOMcom et_CONcoo le_DETdef covoitise_NOMcom	entre_|entrer|_VERcjg	a_PRE l'_DETdef amme_NOMcom._PONfrt Li_DETdef altre_PROind est_VERcjg auditus_NOMcom,_PONfbl li_DETdef oïe_NOMcom,_PONfbl dunt_PROrel um_PROind ot_VERcjg
CommPsia1a, p. 139	oïe_NOMcom,_PONfbl dunt_PROrel um_PROind ot_VERcjg et_CONcoo aprent_VERcjg les_DETdef folies_NOMcom et_CONcoo les_DETdef legeries_NOMcom qui_PROrel la_DETdef parent_NOMcom	entrent_|entrer|_VERcjg	en_PRE l'_DETdef anme_NOMcom si_ADVgen la_PROper guerroient_VERcjg mult_ADVgen._PONfrt Li_DETdef autre_PROind est_VERcjg gustus_ADJqua,_PONfbl li_DETdef gustemenz_NOMcom
CommPsia1a, p. 139	qui_PROrel trop_ADVgen les_PROper maintint_VERcjg._PONfrt Li_DETdef autres_PROind est_VERcjg odoratus_VERppe,_PONfbl li_DETdef odoremens_NOMcom,_PONfbl u_PRE.DETdef parent_NOMcom	entrent_|entrer|_VERcjg	a_PRE l'_DETdef amme_NOMcom ces_DETdem doces_NOMcom odors_NOMcom u_CONcoo li_DETdef cors_NOMcom se_PROper delite_VERcjg encontre_PRE raisun_NOMcom._PONfrt Li_DETdef
CommPsia1a, p. 139	baptismus_NOMcom,_PONfbl corpus_ETR Domini_ETR,_PONfbl et_CONcoo ces_DETdem altres_ADJind institutiuns_NOMcom de_PRE sainte_ADJqua glise_NOMcom par_PRE unt_PROrel un_PROind	entre_|entre|_VERcjg	ad_PRE vitam_NOMcom eternam_ADJqua._PONfrt Et_CONcoo por_PRE ço_PROdem quia_VERcjg exaltas_VERcjg me_PROper,_PONfbl que_CONsub tu_PROper m'_PROper eshauces_VERcjg
CommPsia1a, p. 139	,_PONfbl ço_PROdem est_VERcjg por_PRE les_DETdef sacremenz_NOMcom de_PRE seinte_ADJqua glise_NOMcom qui_PROrel sunt_VERcjg portes_NOMcom par_PRE unt_PROrel un_PROind	entre_|entrer|_VERcjg	in_PRE vitam_NOMcom eternam_ADJqua,_PONfbl por_PRE cest_DETdem benefice_NOMcom :_PONfbl Ge_PROper m'_PROper esleëcerai_VERcjg en_PRE tun_DETpos salu_NOMcom._PONfrt
CommPsia1a, p. 150	amis_NOMcom ?_PONfrt Nes_ADVneg.PROper orroit_VERcjg il_PROper mie_ADVneg ?_PONfrt Certes_ADVgen,_PONfbl dunc_ADVgen seroit_VERcjg il_PROper trop_ADVgen surs_VERppe._PONfrt	Entresait_|entresait|_ADVgen	,_PONfbl fait_VERcjg il_PROper,_PONfbl si_ADVgen fera_VERcjg._PONfrt Et_CONcoo notez_VERcjg qu'_CONsub il_PROper ne_ADVneg dist_VERcjg mie_ADVneg audiet_NOMcom
CommPsia1a, p. 156	le_DETdef heit_NOMcom mais_CONcoo ne_ADVneg se_PROper poet_VERcjg consireir_VERinf,_PONfbl et_CONcoo cil_PROdem en_PROadv avera_VERcjg hastif_ADJqua pardon_NOMcom._PONfrt	Entrues_|entrues|_VERppe	que_CONsub ci_ADVgen a_PRE li_DETdef Prophetes_NOMcom dit_VERcjg que_CONsub Deus_NOMpro fait_VERcjg as_PRE.DETdef bons_ADJqua ;_PONfbl reprendeiz_VERcjg arriere_ADVgen Dominus_NOMcom
CommPsia1a, p. 166	lor_DETpos oilz_NOMcom et_CONcoo disent_VERcjg que_CONsub il_PROper n'_ADVneg iert_VERcjg mie_ADVneg Deus_NOMpro,_PONfbl li_DETdef paien_NOMcom qui_PROrel tot_ADVgen	entresait_|entresait|_ADVgen	disoient_VERcjg :_PONfbl Non_ADVneg est_VERcjg Deus_NOMpro,_PONfbl nus_PROind Deus_NOMpro n'_ADVneg est_VERcjg._PONfrt Et_CONcoo abhominabiles_NOMcom facti_NOMpro sunt_VERcjg
CommPsia1a, p. 168	et_CONcoo a_PRE lor_DETpos doctrine_NOMcom,_PONfbl et_CONcoo cil_PROdem qui_PROrel en_PRE lor_DETpos mescreance_NOMcom et_CONcoo en_PRE lor_DETpos vie_NOMcom	entrent_|entrer|_VERcjg	,_PONfbl il_PROper sunt_VERcjg puant_VERppa et_CONcoo il_PROper sunt_VERcjg ad_PRE mortem_ADJqua anime_ADJqua aturné_VERppe._PONfrt Patens_NOMcom est_VERcjg guttur_NOMcom
CommPsia1a, p. 172	sil_ADVgen.PROper met_VERcjg hom_NOMcom a_PRE l'_DETdef Evangelie_NOMcom sur_PRE le_DETdef senestre_ADJqua cor_NOMcom,_PONfbl si_ADVgen laist_VERcjg hom_NOMcom la_PROper	entres_|entrer|_VERcjg	que_CONsub a_PRE la_DETdef fin_NOMcom de_PRE la_DETdef messe_NOMcom puis_ADVgen sil_ADVgen.PROper reporte_VERcjg um_PROind al_PRE.DETdef destre_ADJqua cor_NOMcom si_ADVgen
CommPsia1a, p. 172	,_PONfbl a_PRE seinte_ADJqua glise_NOMcom qui_PROrel fu_VERcjg des_PRE.DETdef paiens_NOMcom,_PONfbl et_CONcoo a_PRE li_PROper demora_VERcjg et_CONcoo demorera_VERcjg	entros_|entros|_VERppe	qu'_CONsub a_PRE la_DETdef fin_NOMcom._PONfrt Mais_CONcoo en_PRE la_DETdef fin_NOMcom se_PROper returnera_VERcjg il_PROper a_PRE destre_NOMcom si_ADVgen
ProvSerlo, p. 190	,_PONfbl tut_DETind sun_DETpos seruise_NOMcom pert_VERcjg._PONfrt A_PRE tel_DETind marche_NOMcom tel_ADJind uente_VERcjg._PONfrt Ki_PROrel en_PRE ieu_NOMcom	entre_|entrer|_VERcjg	,_PONfbl ieu_NOMcom consente_VERcjg._PONfrt Ki_PROrel feit_VERcjg e_CONcoo nent_PROind ne_ADVneg parfeit_VERcjg,_PONfbl nent_ADVgen ne_ADVneg desert_VERcjg._PONfrt
